{
  "schema_version": "1.1.0",
  "run_id": "run-w-md-001-001",
  "window_id": "w-md-001",
  "plant_id": "plant_ghaziabad_1",
  "started_at": "2026-06-15T06:00:00Z",
  "core_version": "0.1.0",
  "rulepack_pins": [{ "pack": "incomer", "version": "1.0.0" }],
  "inputs": {
    "source": "fixture",
    "fixture_ref": "tests/fixtures/md_window.json",
    "measurement_summary": { "peak_kva": 1120, "points": 12 }
  },
  "detections": [
    {
      "detection_id": "d-md-emit-1",
      "detector_kind": "engine",
      "rule_or_model_ref": "rulepack://incomer/1.0.0#md_overlap",
      "category": "md_overlap",
      "status": "emitted",
      "delivery": "l4",
      "finding": {
        "finding_id": "f-md-001",
        "category": "md_overlap",
        "estimated_monthly_inr": 77000
      },
      "suppressions_checked": ["startup_window", "maintenance_calendar"],
      "scores": { "excess_kva": 220 },
      "logs": ["peak 1120 kVA > band 850", "publish outbox"]
    },
    {
      "detection_id": "d-md-supp-1",
      "detector_kind": "rule",
      "rule_or_model_ref": "rulepack://load_management/1.0.0#stagger_costart",
      "category": "md_overlap",
      "status": "suppressed",
      "delivery": "lab_only",
      "finding": null,
      "suppressions_checked": ["startup_window"],
      "scores": null,
      "logs": ["suppressed: startup_window active 0–8 min"]
    },
    {
      "detection_id": "d-md-shadow-1",
      "detector_kind": "ml_shadow",
      "rule_or_model_ref": "mlflow://timesfm/shadow#md_exceedance",
      "category": "md_exceedance_risk",
      "status": "shadow_only",
      "delivery": "lab_only",
      "finding": null,
      "suppressions_checked": [],
      "scores": { "p90_peak_kva": 980, "pinball": 0.12 },
      "logs": ["TimesFM shadow — not gated (ADR-014)"]
    },
    {
      "detection_id": "d-md-attr-top1",
      "detector_kind": "rule",
      "rule_or_model_ref": "rulepack://attribution/1.0.0#costart_window",
      "category": "md_overlap",
      "status": "emitted",
      "delivery": "l4",
      "finding": {
        "finding_id": "f-attr-001",
        "category": "md_overlap",
        "assets": ["furnace-a"]
      },
      "suppressions_checked": ["startup_window", "maintenance_calendar"],
      "scores": {
        "ramp_kw": 220,
        "hops": 1,
        "proximity": 0.5,
        "score": 110,
        "corr_abs": 0.82,
        "rank": 1,
        "spike_ts": "2026-06-15T06:00:00Z",
        "event_ts": "2026-06-15T05:58:30Z"
      },
      "logs": ["of-record co-start: furnace-a"]
    },
    {
      "detection_id": "d-md-attr-runner",
      "detector_kind": "rule",
      "rule_or_model_ref": "rulepack://attribution/1.0.0#costart_window",
      "category": "md_overlap",
      "status": "hypothesis",
      "delivery": "lab_only",
      "finding": null,
      "suppressions_checked": ["startup_window"],
      "scores": {
        "ramp_kw": 40,
        "hops": 2,
        "proximity": 0.333,
        "score": 13.33,
        "corr_abs": 0.41,
        "rank": 2,
        "spike_ts": "2026-06-15T06:00:00Z",
        "event_ts": "2026-06-15T05:59:10Z"
      },
      "logs": ["runner-up retained lab_only (ADR-015)"]
    },
    {
      "detection_id": "d-md-attr-shadow-ablation",
      "detector_kind": "ml_shadow",
      "rule_or_model_ref": "shadow://attribution/rank_ablation_corr_primary",
      "category": "md_overlap",
      "status": "shadow_only",
      "delivery": "lab_only",
      "finding": null,
      "suppressions_checked": [],
      "scores": {
        "shadow_method": "rank_ablation_corr_primary",
        "agree_with_primary": true,
        "primary_rank_ref": "furnace-a",
        "rank": 1,
        "corr_abs": 0.91
      },
      "logs": ["ADR-016 ranking ablation agrees with primary"]
    }
  ],
  "timeline": [
    { "ts": "2026-06-15T06:00:01Z", "step": "load_fixture", "detail": "12 points" },
    { "ts": "2026-06-15T06:00:02Z", "step": "engine.md_overlap", "detail": "emit" },
    { "ts": "2026-06-15T06:00:02Z", "step": "rule.stagger_costart", "detail": "suppress" },
    { "ts": "2026-06-15T06:00:03Z", "step": "ml.timesfm_shadow", "detail": "shadow_only" },
    { "ts": "2026-06-15T06:00:04Z", "step": "rule.costart_window", "detail": "emit top1 + hypothesis runner" },
    { "ts": "2026-06-15T06:00:05Z", "step": "shadow.rank_ablation", "detail": "lab_only" }
  ],
  "errors": []
}
